title	link	date	abstract	author	surtitle	source
"Bröckelndes Bündnis der  arabischen ""Brüdernationen"""	https://archiv.szarchiv.de/Portal/restricted/Start.act?articleId=A105738786	2019-08-31	"München - Der Krieg in Jemen entwickelt sich zur Belastungsprobe
zwischen den Vereinigten Arabischen Emiraten und Saudi-Arabien.
Regionalpolitische und ideologische Ziele schweißen die Länder
zusammen, die sich eigentlich stets als ""Brüdernationen"" bezeichnen:
Beide wollen das Machtstreben Irans eindämmen und sind keine großen
 ..."		Der Krieg in Jemen entzweit Saudi-Arabien und die Emirate	SZ
Angriff in Jemen	https://archiv.szarchiv.de/Portal/restricted/Start.act?articleId=A105720286	2019-08-30	"Aden - Im Kampf um die südjemenitische Hafenstadt Aden wachsen die
Spannungen zwischen den Verbündeten Saudi-Arabien und den Vereinigten
Arabischen Emiraten (VAE). Die von Saudi-Arabien unterstützte
jemenitische Regierung warf den VAE am Donnerstag einen Luftangriff auf
die Armee vor. Bei der Bombardierung in Aden und der benachbarten Stadt
 ..."		KURZ GEMELDET	SZ
Wende im Jemen-Krieg	https://archiv.szarchiv.de/Portal/restricted/Start.act?articleId=A105516933	2019-08-13	"München - Nach der Einnahme wichtiger Teile der jemenitischen
Hafenstadt Aden durch Separatisten steht der Krieg in Jemen vor einer
Wende. Die Separatisten des Südlichen Übergangsrates (STC) haben nach
mehrtägigen Kämpfen am Wochenende in der strategisch wichtigen
Interimshauptstadt mehrere Lager der Regierungstruppen unter ihre
 ..."		Separatisten besetzen Lager der Regierungstruppen in der Hafenstadt Aden. Beide Seiten rufen zu Waffenruhe auf	SZ
Das Bündnis von Präsident Hadi ist zerbrochen	https://archiv.szarchiv.de/Portal/restricted/Start.act?articleId=A105482964	2019-08-11	"... 
Regieren des Landes sei. Es sei an der Zeit, dass die bestimmenden
Kräfte des Landes ernsthafte Gespräche führten, um den Jemen in einen
föderalen Staat zu überführen, in dem die Interessen aller Seiten
berücksichtigt würden, teilte der stellvertretende Huthi-Außenminister
Hussein al-Azzi mit.
 ..."		Jemen	SZ
Ringen um Lösung für Jemen	https://archiv.szarchiv.de/Portal/restricted/Start.act?articleId=A104753814	2019-07-17	"Sanaa - Der UN-Sonderbeauftragte für Jemen ist zu Gesprächen mit den
Huthi-Rebellen in das Bürgerkriegsland gereist. Martin Griffiths sei am
Dienstag in der Hauptstadt Sanaa eingetroffen, hieß es. Am Montag hatte
er in Saudi-Arabien den international anerkannten Präsidenten Jemens,
Abed Rabbo Mansur Hadi, getroffen. Griffiths ringt seit Monaten um eine
 ..."		AUSLAND	SZ
Mehr Rüstungsexporte	https://archiv.szarchiv.de/Portal/restricted/Start.act?articleId=A103743635	2019-07-12	"... 
kritisierte am Donnerstag vor allem, dass immer noch Rüstungsgüter an
Staaten geliefert werden, die am Jemen-Krieg beteiligt sind. ""Ich sehe
keine vertretbare Grundlage für Rüstungsexporte in diese Region"", sagte
er der Deutschen Presse-Agentur. Grüne und Linke werfen den
Regierungsparteien einen Bruch des Koalitionsvertrags vor.
 ..."		Deutsche Firmen liefern auch an Kriegsparteien in Jemen	SZ
Berlin will Deutsche  in Jemen retten	https://archiv.szarchiv.de/Portal/restricted/Start.act?articleId=A59911972	2015-04-15	"Berlin	- Im Bürgerkriegsland Jemen sitzen ungefähr 90 deutsche
Staatsbürger und Angehörige fest. Nach Informationen der Süddeutschen
Zeitung  prüft die Bundesregierung mittlerweile auch eine Evakuierung
durch die Bundeswehr, um sie dort herauszuholen. Die Bundeswehr soll
aber nur eingesetzt werden, wenn die Ausreise nicht auf zivilem Weg
 ..."		Regierung prüft, ob dazu auch  die Bundeswehr eingesetzt wird	SZ
Berlin will Deutsche  in Jemen retten	https://archiv.szarchiv.de/Portal/restricted/Start.act?articleId=A59911945	2015-04-15	"Berlin - Angesichts einer sich zuspitzenden humanitären Lage in Jemen
prüft die Bundesregierung nach Informationen der Süddeutschen Zeitung,
ob die noch etwa 90 im Land verbliebenen Deutschen durch die Bundeswehr
in Sicherheit gebracht werden können. Der Krisenstab im Auswärtigen Amt
hatte bisher zivile Charterflüge geplant, die aber wegen komplizierter
 ..."			SZ
Regierung prüft Evakuierungs-Einsatz der Bundeswehr	https://archiv.szarchiv.de/Portal/restricted/Start.act?articleId=A59911532	2015-04-14	"... 
Im Bürgerkriegsland Jemen sitzen ungefähr 90 deutsche  Staatsbürger und
Angehörige fest. Da die Lage nach Einschätzung der  Bundesregierung
immer bedrohlicher wird, prüft sie nach Informationen der
Süddeutschen Zeitung mittlerweile auch die Möglichkeit einer
Evakuierung durch  die Bundeswehr. Die soll aber nur eingesetzt werden,
 ..."		Bürgerkrieg im Jemen	SZ
Saudische Luftwaffe bombardiert Militärakademie im Jemen	https://archiv.szarchiv.de/Portal/restricted/Start.act?articleId=A59888180	2015-04-11	"... 
wurde der französische Außenminister Laurent Fabius in	Riad erwartet,
um über die Lage im Jemen zu sprechen. Vor dem	Besuch bekräftigte
Fabius die Solidarität Frankreichs mit dem  ""legitimen Präsidenten""
Hadi."		Vormarsch von Huthi-Miliz	SZ
Stellvertreterkrieg am Golf von Aden	https://archiv.szarchiv.de/Portal/restricted/Start.act?articleId=A59868668	2015-04-10	"Kairo  - Mit Blick auf den Krieg in Jemen hat US-Außenminister John
Kerry eine deutliche Warnung an Iran gerichtet. Die USA würden ""nicht
tatenlos zusehen, wie eine ganze Region destabilisiert"" werde, sagte er
in der Nacht zum Donnerstag . Zugleich warf er der Regierung in Teheran
vor, die mit ihr verbündeten schiitischen Huthi-Miliz mit
 ..."		USA kritisieren Hilfe Irans für schiitische Milizen in Jemen, mischen sich aber selber ein	SZ
Zivilisten in der Falle	https://archiv.szarchiv.de/Portal/restricted/Start.act?articleId=A59836841	2015-04-07	"Kairo  - Die Situation der Zivilbevölkerung in Jemen spitzt sich fast
zwei Wochen nach Beginn der Offensive Saudi-Arabiens und verbündeter
arabischer und muslimischer Staaten zu. Nach Angaben der Vereinten
Nationen kamen bis zum vergangenen Donnerstag bereits mehr als 500
Menschen bei Kämpfen ums Leben. Am Osterwochenende starben überdies
 ..."		Immer heftiger tobt der Kampf um die Vorherrschaft in Jemen. In Aden sind ganze Viertel von der Versorgung abgeschnitten	SZ
Der Zerfall eines Landes, eine Frage der Zeit	https://archiv.szarchiv.de/Portal/restricted/Start.act?articleId=A59836822	2015-04-07	"... 
Jemen ist - nach dem Irak, Syrien und Libyen - das vierte arabische
Land, das durch den gegenwärtigen Bürgerkrieg dabei ist, seine
staatliche Existenz zu verlieren. Die Luft-Offensive der Saudis gegen
die aufständischen Huthis hat es in neun Nächten nicht vermocht, diese
vom Vordringen in die südlichen Hafenstadt Aden abzuhalten oder ihre
 ..."		JEMEN	SZ
UN-Sicherheitsrat vertagt Resolution zu Feuerpause	https://archiv.szarchiv.de/Portal/restricted/Start.act?articleId=A59835928	2015-04-05	"Russlands Vorstoß zum Stopp der saudi-arabischen Luftschläge  im Jemen
verhallt zunächst. Der UN-Sicherheitsrat hat eine  Entscheidung
vertagt. Die Huthi-Miliz drängt derweil die jemenitischen
Regierungstruppen weiter in die Defensive.
UN-Sicherheitsrat will Bedenkzeit
 ..."		Konflikt im Jemen	SZ
Rotes Kreuz befürchtet humanitäre Katastrophe	https://archiv.szarchiv.de/Portal/restricted/Start.act?articleId=A59835370	2015-04-05	"Immer mehr Zivilisten sterben bei Kämpfen und durch die  saudischen
Luftschläge im Jemen. Das Rote Kreuz und Russland fordern  eine
sofortige Feuerpause.
Rotes Kreuz spricht von katastrophaler humanitärer Situation
Das Internationale Komitee vom Roten Kreuz (IKRK) hat an  die
 ..."		Konflikt im Jemen	SZ
Deutsche aus Jemen gerettet	https://archiv.szarchiv.de/Portal/restricted/Start.act?articleId=A59823857	2015-04-04	"Peking	-Die chinesische Marine hat 225 Ausländer aus dem umkämpften
Jemen evakuiert, darunter auch Deutsche. Sie seien am
Donnerstagnachmittag von Aden aus mit einem Schiff in die
ostafrikanische Republik Dschibuti transportiert worden, teilte das
chinesische Außenministerium mit. Die Aktion sei ""sehr riskant""
 ..."		AUSLAND	SZ
Tote bei Angriffen in Jemen	https://archiv.szarchiv.de/Portal/restricted/Start.act?articleId=A59812077	2015-04-02	"Hodeida  -Bei einem Luftangriff der von Saudi-Arabien geführten
Koalition sind in einer Molkerei in Jemen mindestens 29Menschen getötet
worden. Dutzende Arbeiter seien verletzt, berichteten Klinikärzte. Die
Fabrikanlage in der Hafenstadt Hodeida war in der Nacht zum Mittwoch
bombardiert worden. Sie liegt in einem Gebiet, das von den schiitischen
 ..."		AUSLAND	SZ
Al-Qaida-Kämpfer befreien 300 Häftlinge	https://archiv.szarchiv.de/Portal/restricted/Start.act?articleId=A59821866	2015-04-02	"Jemen steht am Rand eines Bürgerkriegs. Al-Qaida-Kämpfer  befreien im
Südosten des Landes 300 Häftlinge. Schiitische Huthi-Rebellen
attackieren den Präsidentenpalast in Aden.
300 Häftlinge befreit - sieben Tote
Kämpfer der Islamistengruppe al-Qaida auf der arabischen  Halbinsel
 ..."		Jemen	SZ
Mindestens 29 Tote bei Angriff auf Molkerei	https://archiv.szarchiv.de/Portal/restricted/Start.act?articleId=A59811604	2015-04-01	"Im Westen von Jemen wird eine Molkerei angegriffen, mindestens	29
Menschen sterben. Die meisten sind wohl Arbeiter. Ob die  von
Saudi-Arabien angeführte Militärkoalition dafür verantwortlich	ist,
ist unklar.
Tote sollen Arbeiter sein
 ..."		Luftschläge in Jemen	SZ
USA liefern wieder Kampfjets an Ägypten	https://archiv.szarchiv.de/Portal/restricted/Start.act?articleId=A59811080	2015-04-01	"... 
Militärkoalition unter der Führung Saudi-Arabiens an, die  derzeit
Luftangriffe gegen die schiitischen Huthi-Rebellen im Jemen  fliegt.
Die USA unterstützen den vor den Huthi-Rebellen geflohenen  Präsidenten
Abed Rabbo Mansur Hadi.
Außerdem geht Ägypten im Nachbarland Libyen gegen Islamisten  vor: Die
 ..."		Konflikte in Jemen und Libyen	SZ
1400 Kinder in Jemen getötet	https://archiv.szarchiv.de/Portal/restricted/Start.act?articleId=A69673821	2017-01-12	"Sanaa - Seit dem Beginn der Luftangriffe einer von Saudi-Arabien
geführten Koalition im Bürgerkriegsland Jemen sind dort nach UN-Angaben
fast 1400 Kinder getötet worden. Mehr als 2100 Kinder seien seit März
2015 verletzt worden, teilte das Kinderhilfswerk Unicef am Mittwoch in
Jemens Hauptstadt Sanaa mit. Die tatsächlichen Zahlen lägen
 ..."		AUSLAND	SZ
Dutzende Soldaten sterben bei Selbstmordanschlag in Jemen	https://archiv.szarchiv.de/Portal/restricted/Start.act?articleId=A69487112	2016-12-18	"... 
Jemen ist der ärmste Staat der arabischen Welt. Seit 2013 tobt ein
Bürgerkrieg. Anhänger der schiitischen Huthi-Rebellen, die vom Iran
unterstützt werden, kämpfen gegen die jemenitische Regierung und ein
vom Nachbarstaat Saudi-Arabien geführtes sunnitisches Militärbündnis.
Auch die USA sind an dem Konflikt beteiligt .
 ..."		Mittlerer Osten	SZ
Hungersnot bedroht Jemen	https://archiv.szarchiv.de/Portal/restricted/Start.act?articleId=A69475204	2016-12-17	"Genf - Jemen steht nach fast zwei Jahren Krieg vor einer Hungersnot.
Die Kinder sterben, sagte der UN-Koordinator für humanitäre Hilfe im
Land, Jamie McGoldrick, am Freitag. Für mehr als die Hälfte der
28Millionen Jemeniten sei die Nahrungsversorgung nicht gesichert,
sieben Millionen seien akut von Hunger bedroht. Die Lage erschwert,
 ..."		AUSLAND	SZ
USA liefern Waffen  an Saudis nicht aus	https://archiv.szarchiv.de/Portal/restricted/Start.act?articleId=A69442878	2016-12-14	"... 
Luftangriffen der von Saudi-Arabien geführten Militärkoalition in
Jemen. Zugleich bauen sie ihre Zusammenarbeit mit dem Land in anderen
Gebieten aus. ""Entweder, sie nehmen sich unseren Rat zu Herzen und
hören mehr auf uns, oder wir werden zumindest manche ihrer Aktivitäten
nicht länger unterstützen"", zitiert die Nachrichtenagentur Reuters
 ..."		Wegen des Jemenkriegs schränkt  Washington Rüstungsexport ein	SZ
Zündstoff	https://archiv.szarchiv.de/Portal/restricted/Start.act?articleId=A69342490	2016-12-03	"... 
Im März 2015 hat eine von Saudi-Arabien geführte Militärallianz in
den Bürgerkrieg in Jemen eingegriffen. Ausgestattet mit einem Mandat
des UN-Sicherheitsrates versucht sie, dem international anerkannten
Präsidenten Abd Rabbo Mansur Hadi wieder die Kontrolle über das Land zu
verschaffen. Er war vor anrückenden Milizen der Huthis, einer
 ..."		Deutschland rüstet weiter Saudi-Arabien auf, das zivile Ziele in Jemen bombardiert	SZ
Die Katar-Connection	https://archiv.szarchiv.de/Portal/restricted/Start.act?articleId=A63608990	2015-11-13	"... 
kleine Emirat in tiefe Trauer stürzt: ""Wir gratulieren uns und unserem
Volk zum Märtyrertod eines Sohnes unseres Heimatlandes in Jemen. Möge
Gott ihn in den höchsten Himmel aufnehmen und seiner Familie Langmut
und Trost schenken"", schrieb der Minister. Muhammad Hamid Sulayman ist
der erste katarische Soldat, der im Zuge der von Saudi-Arabien
 ..."		Der Außenminister des Emirats twittert vom Tod eines Soldaten in Jemen - und bestätigt so, dass  sein Land dort an Kämpfen teilnimmt. Die Bundesregierung bringt das wegen eines Panzergeschäfts in Erklärungsnot	SZ
Jemen bittet Vereinte Nationen um Bodentruppen	https://archiv.szarchiv.de/Portal/restricted/Start.act?articleId=A60122081	2015-05-07	"... 
Jemen ruft Vereinte Nationen an
Angesichts der Offensive der schiitischen Huthi-Rebellen  im Süden hat
der Jemen den UN-Sicherheitsrat um Hilfe durch	den Einsatz von
Bodentruppen gebeten. Der jemenitische UN-Botschafter  schrieb am
Mittwoch an das Gremium: ""Wir fordern die internationale  Gemeinschaft
 ..."		UN-Sicherheitsrat	SZ
Fremde Truppen in Jemen	https://archiv.szarchiv.de/Portal/restricted/Start.act?articleId=A60080394	2015-05-04	"Kairo - Die von Saudi-Arabien geführte Militärkoalition hat im Zuge
ihrer Offensive gegen die Huthi-Miliz in Jemen offenbar mehrere Dutzend
Soldaten einer Spezialeinheit für eine Erkundungsmission in Aden
abgesetzt. Das bestätigte laut der Nachrichtenagentur AP ein Kommandeur
der jemenitischen Regierungstruppen in der zweitgrößten Stadt des
 ..."		AUSLAND	SZ
Fremde Truppen  betreten Jemen	https://archiv.szarchiv.de/Portal/restricted/Start.act?articleId=A60079732	2015-05-04	"Kairo - Die von Saudi-Arabien geführte Militärkoalition hat im Zuge
ihrer Offensive gegen die Huthi-Miliz in Jemen offenbar mehrere Dutzend
Soldaten eine Spezialeinheit für eine Erkundungsmission in Aden
abgesetzt. Das bestätigte laut der Nachrichtenagentur Associated Press
ein Kommandeur der jemenitischen Regierungstruppen in der zweitgrößten
 ..."		Saudisch geführtes Militärbündnis  setzt Intervention fort	SZ
"Menschenrechtler werfen Saudis Einsatz von Streubomben
im Jemen vor"	https://archiv.szarchiv.de/Portal/restricted/Start.act?articleId=A60079367	2015-05-03	"Fotos und Satellitenbilder sollen belegen, dass die von  Saudi-Arabien
geführte Koalition im Jemen international geächtete Streubomben
einsetzt. Die Munition stammt wohl aus den USA.
Streubomben sollen in der Nähe von Siedlungen abgeworfen  worden sein
Die Menschenrechtsorganisation Human Rights Watch (HRW)  hat der von
 ..."		Luftangriffe auf Huthi-Miliz	SZ
Zwischen Sturm und Hoffnung	https://archiv.szarchiv.de/Portal/restricted/Start.act?articleId=A59988065	2015-04-23	"Kairo - Die von Saudi-Arabien geführte Militär-Koalition hat auch am
Mittwoch weiter Luftangriffe auf Ziele der Huthi-Miliz in Jemen
geflogen. Kampfjets bombardierten Militärstützpunkte nahe der
umkämpften Hafenstadt Aden und in Taizz, der zweitgrößten Stadt des
Landes. Das Verteidigungsministerium in Riad hatte am späten
 ..."		Die von Saudi-Arabien angeführte Koalition ändert ihre Strategie in Jemen	SZ
Gestolpert im Hinterhof	https://archiv.szarchiv.de/Portal/restricted/Start.act?articleId=A59988033	2015-04-23	"... 
Vier Wochen hat die von Saudi-Arabien geführte Koalition Ziele in Jemen
bombardiert und das Land mit einer Luft- und Seeblockade belegt. Die
Bilanz der Operation Sturm der Entschlossenheit ist verheerend: Tausend
Menschen haben nach UN-Angaben ihr Leben verloren, tatsächlich dürfte
die Opferzahl aber weit höher liegen. Die ohnehin mangelhafte
 ..."		JEMEN	SZ
Jemen-Einsatz beendet	https://archiv.szarchiv.de/Portal/restricted/Start.act?articleId=A59978035	2015-04-22	"Kairo  - Saudi-Arabien hat am späten Dienstagabend das Ende der
Militäroffensive in Jemen verkündet, die das Königreich und seine
arabischen Verbündeten vor knapp vier Wochen unter dem Codenamen Sturm
der Entschlossenheit  begonnen hatten. Der Einsatz habe seine
militärischen Ziele erreicht, hieß es in einer Erklärung des
 ..."		AUSLAND	SZ
Saudi-Arabien bombardiert wieder Huthi-Stellungen in Jemen	https://archiv.szarchiv.de/Portal/restricted/Start.act?articleId=A59987214	2015-04-22	"Gestern noch erklärte Saudi-Arabien seine Luftangriffe	auf Jemen für
beendet, wenige Stunden später bombardieren saudische  Jets schon
wieder Stellungen der Huthi-Rebellen.
Saudi-Arabien greift weiter militärisch in Jemen ein
Obwohl Saudi-Arabien das Ende seiner militärischen Operation  ""Sturm
 ..."		Einmischung in Bürgerkrieg	SZ
Arabische Militärkoalition beendet Luftangriffe auf Jemen	https://archiv.szarchiv.de/Portal/restricted/Start.act?articleId=A59977593	2015-04-21	"Saudi-Arabien stellt die seit einigen Wochen laufenden	Luftangriffe
gegen die Huthi-Rebellen in Jemen ein. Nun soll Teil zwei  der
Operation anlaufen.
Saudi-Arabien beendet Einsatz in Jemen
Die arabische Militärkoalition beendet nach knapp vier	Wochen ihre
 ..."		Bürgerkrieg	SZ
USA entsenden Kriegsschiffe in Richtung Jemen	https://archiv.szarchiv.de/Portal/restricted/Start.act?articleId=A59976412	2015-04-21	"... 
Militärpräsenz und schicken Schiffe ins Arabische  Meer. Grund könnte
die Sorge vor iranischen Waffenlieferungen  an die Huthi-Miliz im Jemen
sein.
US-Kriegsschiffe sollen Schiffahrtswege sichern
Die USA haben zwei weitere Kriegsschiffe in Richtung Jemen  entsandt.
 ..."		Machtkampf um den Jemen	SZ
Das Leiden wird schlimmer	https://archiv.szarchiv.de/Portal/restricted/Start.act?articleId=A59955393	2015-04-20	"... 
Entschlossenheit  geht bald in die fünfte Woche - eine Ende des Krieges
in Jemen oder gar eine politische Lösung des Konflikts ist nicht
absehbar. Das Leiden der Zivilbevölkerung allerdings wird Tag für Tag
schlimmer. Sieben Tage ist die Hauptstadt Sanaa nun ohne Strom. Am
Sonntag gelang es, einen Dieselgenerator zum Laufen zu bringen. Er
 ..."		In Jemen verschlechtert sich die humanitäre Lage durch Bodenkämpfe und Luftangriffe	SZ
Deutsche verlassen Jemen	https://archiv.szarchiv.de/Portal/restricted/Start.act?articleId=A59943412	2015-04-18	"Berlin	- Das Auswärtige Amt hat am Freitag mehr als 100 Menschen aus
dem Bürgerkriegsland Jemen ausfliegen lassen. An Bord eines
gecharterten Flugzeugs einer jordanischen Gesellschaft seien deutsche
Staatsangehörige sowie Bürger anderer Staaten und Familienangehörige
aus Jemen in die ostafrikanische Republik Dschibuti gebracht worden,
 ..."			SZ
Iran fordert Ende der saudischen Militärangriffe	https://archiv.szarchiv.de/Portal/restricted/Start.act?articleId=A59952579	2015-04-18	"Irans Präsident Ruhani verlangt eine politische Lösung	im Bürgerkrieg
in Jemen. Saudi-Arabien soll seine Angriffe  auf das Land einstellen.
Die Bundesregierung hat indes 100  Menschen aus dem Krisengebiet
ausgeflogen.
Iran verlangt politische Lösung in Jemen
 ..."		Bürgerkrieg in Jemen	SZ
UN bestrafen Huthis in Jemen	https://archiv.szarchiv.de/Portal/restricted/Start.act?articleId=A59922342	2015-04-16	"Kairo  - Die schiitischen Huthi-Rebellen in Jemen haben die gegen ihre
Führung verhängten Sanktionen des UN-Sicherheitsrates scharf
zurückgewiesen. Das Gremium hätte ""sich besser mit Saudi-Arabien
beschäftigen sollen"", sagte Mohammed al-Buchaiti, ein Mitglied des
Politbüros der Huthi-Bewegung, am Mittwoch der Deutschen Presse-Agentur
 ..."		AUSLAND	SZ
UN-Sonderbotschafter für Jemen wirft hin	https://archiv.szarchiv.de/Portal/restricted/Start.act?articleId=A59931647	2015-04-16	"Seit vier Jahren versucht der UN-Sondergesandte Jamal Benomar  im Jemen
zwischen verfeindeten Lagern zu vermitteln. Mitten  im Bürgerkrieg legt
er nun sein Amt nieder.
Inmitten des tiefen Konflikts im Jemen hat der zuständige
UN-Sondergesandte Jamal Benomar seinen Rücktritt eingereicht. Ein
 ..."		Bürgerkrieg	SZ
Münchner wollte offenbar mit Söldnergruppe in Jemen-Krieg eingreifen	https://archiv.szarchiv.de/Portal/restricted/Start.act?articleId=A114481801	2022-03-29	"... 
Anfang 2021"" beschlossen haben, mit einer Söldnertruppe in den Krieg im
Jemen einzugreifen. 100 bis 150 Mann wollten die beiden unter ihrem
Kommando versammeln, so die Bundesanwaltschaft: ""Diese Einheit hätte
sich vor allem aus ehemaligen Angehörigen deutscher Spezialeinheiten
zusammensetzen (...) sollen."" Mit ihrer Truppe wollten die beiden
 ..."		Anklage der Bundesanwaltschaft	SZ
Die anderen Hilfesuchenden	https://archiv.szarchiv.de/Portal/restricted/Start.act?articleId=A114044105	2022-03-29	"... 
Die Menschen kommen häufig aus dem Irak, aus Afghanistan, Jemen, auch
aus Sudan oder Nigeria. Die Grenzübertritte gelten als illegal, weil
die Menschen keine Papiere oder Visa haben. Die Zahl dieser
Grenzübertritte steigt nun wieder - und damit nach Beobachtungen der
NGOs auch die Zahl der ebenfalls illegalen Pushbacks zurück nach
 ..."		Flüchtende aus Afghanistan, Jemen und anderen Ländern versuchen jeden Tag, über Belarus in die EU zu gelangen. Polen baut deshalb eine Mauer an der Grenze	SZ
Huthi lassen Drohnen sprechen	https://archiv.szarchiv.de/Portal/restricted/Start.act?articleId=A114041346	2022-03-22	"... 
In Jemen herrscht seit 2015 Krieg zwischen den von Saudi-Arabien und
anderen arabischen Staaten unterstützten Truppen von Präsident Abed
Rabbo Mansur Hadi und den von Iran unterstützten Huthi-Rebellen. Der
saudische Kronprinz Mohammed bin Salman, der die Militäroperation 2015
noch ""Decisive Storm"" (entscheidender Sturm) nannte, hoffte damals auf
 ..."		Statt Zusage zu Friedenstreffen: Jemenitische Milizen attackieren saudische Ölanlagen	SZ
Noch mehr Hunger droht	https://archiv.szarchiv.de/Portal/restricted/Start.act?articleId=A114041339	2022-03-22	"Vergessener Krieg, so wird der Konflikt in Jemen häufig genannt. Man
mag sich gar nicht ausmalen, wie weit er angesichts der russischen
Invasion in die Ukraine weiter in Vergessenheit geraten wird. Ein
Drittel der Weizen-Importe Jemens stammen aus der Ukraine. 13 Millionen
Jemenitinnen und Jemeniten sind schon jetzt vom Hungertod bedroht. Und
 ..."		JEMEN	SZ
Noch mehr Hunger droht	https://archiv.szarchiv.de/Portal/restricted/Start.act?articleId=A114418285	2022-03-21	"... 
Der vergessene Krieg, so wird der Konflikt in Jemen häufig genannt. Man
mag sich gar nicht ausmalen, wie weit er angesichts der russischen
Invasion in die Ukraine weiter in Vergessenheit geraten wird. Ein
Drittel der Weizen-Importe Jemens stammen aus der Ukraine. 13 Millionen
Jemenitinnen und Jemeniten sind schon jetzt vom Hungertod bedroht. Und
 ..."		Jemen	SZ
Drohnen statt Kompromisse	https://archiv.szarchiv.de/Portal/restricted/Start.act?articleId=A114418255	2022-03-21	"... 
In Jemen herrscht seit 2015 Krieg zwischen den von Saudi-Arabien und
anderen arabischen Staaten unterstützten Truppen von Präsident Abed
Rabbo Mansur Hadi und den von Iran unterstützten Huthi-Rebellen. Der
saudische Kronprinz Mohammed bin Salman, der die Militäroperation 2015
noch ""Decisive Storm"" (entscheidender Sturm) nannte, hoffte damals auf
 ..."		Jemen	SZ
45 Tote bei Luftangriff	https://archiv.szarchiv.de/Portal/restricted/Start.act?articleId=A59792836	2015-03-30	"Schwere Kämpfe im Jemen: Bei einem Luftangriff auf ein
Flüchtlingslager sollen im Nordwesten des Landes mindesten 45 Menschen
getötet,  200 weitere verletzt worden sein. Unklar ist, wer für die
Attacke  verantwortlich ist.
75 Helfer im Einsatz
 ..."		Kämpfe im Jemen	SZ
Arabische Liga beschließt Gründung gemeinsamer Eingreiftruppe	https://archiv.szarchiv.de/Portal/restricted/Start.act?articleId=A59781012	2015-03-29	"Im Kampf gegen radikalislamische Rebellengruppen können  Länder wie
Irak oder Jemen auf mehr Unterstützung hoffen. Eine  militärische
Eingreiftruppe der Arabischen Liga soll in Zukunft eingreifen.
Detaillierte Planung soll im April erfolgen
Angesichts der zahlreichen gewaltsamen Konflikte in der  Region hat die
 ..."		Kampf gegen Rebellen im Jemen	SZ
Menschen fliehen aus Sanaa	https://archiv.szarchiv.de/Portal/restricted/Start.act?articleId=A59768278	2015-03-28	"... 
Ali Abdullah Saleh und werden von dessen Sohn Ahmed befehligt. Saleh
hat sich mit den Huthis verbündet und gilt vielen in Jemen als
treibende Kraft hinter der Eskalation der vergangenen Wochen. Nach
Angaben der Huthis starben erneut 15 Menschen bei den Angriffen.
Augenzeugen berichteten, viele Bewohner Sanaas versuchten, wegen der
 ..."		Saudi-Arabien setzt seine Luftangriffe auf Jemens Hauptstadt fort	SZ
Eskalation in Jemen verunsichert die Anleger	https://archiv.szarchiv.de/Portal/restricted/Start.act?articleId=A59756947	2015-03-27	"Die Eskalation des Konflikts in Jemen hat an den Aktienmärkten am
Donnerstag für Verunsicherung gesorgt. Die Risikobereitschaft der
Investoren habe angesichts der Auseinandersetzung in der ölreichen
Golfregion nachgelassen, sagte Analyst Markus Huber vom
Wertpapierhändler Peregrine & Black. Nach der Aktienmarkt-Rally der
 ..."			SZ
Jemen-Krise macht Öl wieder teurer	https://archiv.szarchiv.de/Portal/restricted/Start.act?articleId=A59756946	2015-03-27	"Die militärische Eskalation der Krise in Jemen hat am Donnerstag die
Ölpreise kräftig angeschoben. Nordseeöl der Sorte Brent verteuerte sich
in der Spitze um 5,8 Prozent auf 59,78 Dollar je Barrel (159 Liter).
""Geopolitische Risiken wie diese sind zuletzt ausgeblendet worden, da
sich die Marktteilnehmer auf das globale Überangebot fokussiert haben"",
 ..."			SZ
