title	link	date	abstract	author	surtitle	source
Ranghoher Anführer der Houthi-Rebellen getötet	https://www.faz-biblionet.de/faz-portal/document?uid=FAZN__20180423_5556970	2018-04-23	"Die Houthi-Rebellen im Jemen haben ihren politischen Führer bei einem Angriff verloren. Die Rebellen gaben am Montag den Tod des Chefs ihres ...
         ..Die Houthi-Rebellen im Jemen haben ihren politischen Führer bei einem Angriff verloren...  ..Die schiitischen Houthi-Rebellen beherrschen seit Jahren weite Teile im Norden und Westen des Jemen...  ..Die saudiarabisch dominierte Militärkoalition kämpft seit 2015 im Jemen gegen die Houthi-Rebellen..."		Jemen	FAZ
20 Tote bei Angriff auf Hochzeit	https://www.faz-biblionet.de/faz-portal/document?uid=FAZN__20180423_5556055	2018-04-23	"Bei einem Luftangriff der saudisch geführten Militärkoalition auf eine Hochzeit im Bürgerkriegsland Jemen sind dem Gesundheitsministerium zufolge ...
         ..Bei einem Luftangriff der saudisch geführten Militärkoalition auf eine Hochzeit im Bürgerkriegsland Jemen sind dem Gesundheitsministerium..  ..Die Bundesregierung unterstützt die international anerkannte Regierung des Jemen...  ..In dem konkreten Fall geht es um die Bombardierung eines Ortes im Nordwesten des Jemen im Oktober 2016..."		Jemen-Krieg	FAZ
Zahlreiche Tote bei Luftangriff auf Al Qaida im Jemen	https://www.faz-biblionet.de/faz-portal/document?uid=FAZN__20170129_4787182	2017-01-29	"Bei einem amerikanischen Militäreinsatz im Jemen sind nach Angaben der Vereinigten Staaten vierzehn Kämpfer der Terrormiliz Al-Qaida getötet ...
         ..Bei einem amerikanischen Militäreinsatz im Jemen sind nach Angaben der Vereinigten Staaten vierzehn Kämpfer der Terrormiliz..  ..Es war der erste großangelegte Militäreinsatz im Jemen seit der Amtsübernahme des neuen amerikanischen Präsidenten, für den..  ..Im Jemen gibt es immer wieder gezielte Angriffe auf Mitglieder der Extremistengruppe Al Qaida auf der Arabischen Halbinsel.."		Amerikanischer Soldat stirbt	FAZ
Riad hat britische Streubomben im Jemen eingesetzt	https://www.faz-biblionet.de/faz-portal/document?uid=FAZ__FD1201612215024783	2016-12-21	"job. LONDON, 20. Dezember. Die britische Regierung hat bestätigt, dass die Luftwaffe Saudi-Arabiens im Kampf gegen die Houthi-Rebellen britische ...
         ..Regierung hat bestätigt, dass die Luftwaffe Saudi-Arabiens im Kampf gegen die Houthi-Rebellen britische ""Cluster-Bomben"" im Jemen..  ..seit Monaten, die militärische Unterstützung Saudi-Arabiens auszusetzen, das die Koalition gegen die Houthi-Rebellen im Jemen..  ..Der SNP-Abgeordnete Brendan O'Hara verlangte eine Untersuchungskommission zu den Völkerrechtsverletzungen in Jemen..."		Großbritannien bestätigt Vorwurf / Opposition fordert Aussetzung militärischer Unterstützung	FAZ
IS bekennt sich zu Selbstmordanschlag	https://www.faz-biblionet.de/faz-portal/document?uid=FAZN__20161218_4580698	2016-12-18	"Die Terrormiliz ""Islamischer Staat"" (IS) hat sich zu dem schweren Selbstmordanschlag auf Soldaten in der jemenitischen Hafenstadt Aden bekannt. ...
         ..Im Jemen tobt seit rund zwei Jahren ein Bürgerkrieg zwischen Anhängern der Regierung und schiitischen Huthi-Rebellen...  ..Das Terrornetzwerk Al Qaida und der IS haben sich in der Vergangenheit mehrfach zu Anschlägen im Jemen bekannt.

dpa.."		Jemen	FAZ
Desaster im Stellvertreterkrieg	https://www.faz-biblionet.de/faz-portal/document?uid=FAZ__FD1N201612155013704	2016-12-15	"Wenn iranische Nachrichtenagenturen Irans Generäle mit visionären Aussagen zitieren, dann steckt dahinter Kalkül. Das gilt auch für die Äußerungen ...
         ..Genau das könnte allerdings Teil der iranischen Strategie sein, denn dadurch wird der Konflikt im Jemen, dem geopolitischen..  ..Saudi-Arabien stellt auch den Krieg im Jemen als solchen dar, doch die Wirklichkeit ist weniger eindeutig...  ..In dieser Situation könnte dem Jemen eine dauerhafte (und instabile) Teilung bevorstehen..."		Der Konflikt im Jemen: Saudische Ängste und iranische Provokationen / Von Jonathan Hackenbroich	FAZ
IS-Attentat im Jemen	https://www.faz-biblionet.de/faz-portal/document?uid=FAZ__FR1201612125016642_5	2016-12-12	"Bei einem Anschlag auf eine Kaserne in der südjemenitischen Stadt Aden sind 48 Soldaten getötet und 29 weitere verletzt worden. Ein Selbstmordattentäter ...
         ..Im Jemen kämpfen seit September 2014 Truppen des ins Exil geflüchteten sunnitischen Präsidenten Abd Rabbo Mansur Hadi gegen.."		Wichtiges in Kürze	FAZ
Eine Lösung für den Jemen	https://www.faz-biblionet.de/faz-portal/document?uid=FAZ__FD1201802265362095	2018-02-26	"Der saudische Krieg im Jemen hat das Land ins Elend gestürzt. Er hat Tausende von Zivilisten getötet, Millionen Menschen vertrieben und eine ...
         ..Der saudische Krieg im Jemen hat das Land ins Elend gestürzt...  ..Denn es würde ihnen ermöglichen, sich aus dem Sumpf des Jemen-Kriegs herauszuziehen...  ..der EU und anderer Länder führen, die Bewaffnung des Jemen-Kriegs zu beenden..."		Fremde Federn: Seyed Hossein Mousavian	FAZ
Unicef: Millionen Kinder im Jemen vom Tod bedroht	https://www.faz-biblionet.de/faz-portal/document?uid=FAZ__FD1202011246134702_6	2020-11-24	"Mehrere Millionen Kinder im Jemen sind laut Unicef vom Tod durch Hunger und Krankheiten bedroht. In bestimmten Gebieten des Konfliktlandes hätten ...
         ..Mehrere Millionen Kinder im Jemen sind laut Unicef vom Tod durch Hunger und Krankheiten bedroht..."		Wichtiges in Kürze	FAZ
Attacke auf saudische Ölanlagen	https://www.faz-biblionet.de/faz-portal/document?uid=FAZ__FD1N201905155709848	2019-05-15	"cheh. BEIRUT, 14. Mai. Ein Drohnenangriff auf Ölanlagen in Saudi-Arabien hat die ohnehin großen Spannungen in der Golfregion weiter verschärft. ...
         ..Die Vermittlungsbemühungen im Jemen-Konflikt hatten zuletzt ein wenig an Fahrt aufgenommen...  ..An diesem Mittwoch soll der UN-Sicherheitsrat über die Lage im Jemen und den Fortgang der Vermittlungsinitiative des UN-Sondergesandten.."		Jemenitische Houthi reklamieren Drohnenangriff für sich	FAZ
Houthis ziehen sich aus Hafenstadt zurück	https://www.faz-biblionet.de/faz-portal/document?uid=FAZN__20190512_6183402	2019-05-12	"Im Bürgerkriegsland Jemen haben die schiitischen Houthi-Rebellen nach eigenen Angaben mit dem vereinbarten Abzug aus der strategisch wichtigen ...
         ..Im Bürgerkriegsland Jemen haben die schiitischen Houthi-Rebellen nach eigenen Angaben mit dem vereinbarten Abzug aus der..  ..Im Februar hatten sich die international anerkannte Regierung im Jemen mit den Houthis auf den Abzug geeinigt, um eine Ende..  ..Der Jemen ist eines der ärmsten Länder der arabischen Welt und leidet seit 2014 unter dem Konflikt zwischen den von Saudi-Arabien.."		Krieg im Jemen	FAZ
Acht Tote bei Überschwemmungen im Jemen	https://www.faz-biblionet.de/faz-portal/document?uid=FAZN__20220724_8196314	2022-07-24	"Nach starkem Regen im Jemen sind mindestens acht Menschen in den Fluten ums Leben gekommen. In Sanaa starben zwei Kinder, als ihr Haus wegen ...
         ..Bei Überschwemmungen nach starkem Regen sind im Jemen mindestens acht Menschen ums Leben gekommen...  ..Im Jemen tobt seit Jahren ein Bürgerkrieg, der in dem Land auf der Arabischen Halbinsel eine der schwersten humanitären Krisen.."		Kinder unter den Opfern	FAZ
Eine halbe Million Cholera-Fälle im Jemen	https://www.faz-biblionet.de/faz-portal/document?uid=FAZ__FD1201708155207780	2017-08-15	"GENF, 14. August (dpa). Die Cholera-Epidemie im Bürgerkriegsland Jemen hat die Marke von 500 000 Fällen überschritten. Fast 2000 Menschen seien ...
         ..Die Cholera-Epidemie im Bürgerkriegsland Jemen hat die Marke von 500 000 Fällen überschritten...  ..Die Epidemie im Jemen ist der größte bisher erfasste Ausbruch der Infektionskrankheit auf der ganzen Welt..."			FAZ
Eine halbe Million Cholera-Fälle im Jemen	https://www.faz-biblionet.de/faz-portal/document?uid=FAZN__20170814_5150899	2017-08-14	"Die Cholera-Epidemie im Bürgerkriegsland Jemen hat die Marke von 500.000 Fällen überschritten. Fast 2000 Menschen seien schon an der gefährlichen ...
         ..Die Cholera-Epidemie im Bürgerkriegsland Jemen hat die Marke von 500.000 Fällen überschritten...  ..Die Epidemie im Jemen ist der größte bisher erfasste Ausbruch der Infektionskrankheit auf der ganzen Welt..."		5000 Infektionen pro Tag	FAZ
Flüchtlinge ertrinken vor Jemen	https://www.faz-biblionet.de/faz-portal/document?uid=FAZ__FD2201708115204949_5	2017-08-11	"Nach Angaben der Internationalen Organisation für Migration (IOM) haben Schlepper vor der Küste Jemens zahlreiche Migranten aus Somalia und ...
         ..Trotz des Bürgerkriegs im Jemen kamen in den vergangenen Jahren immer wieder Flüchtlingsboote aus Somalia nach Jemen..."		Wichtiges in Kürze	FAZ
Schlepper stoßen Flüchtlinge ins Meer	https://www.faz-biblionet.de/faz-portal/document?uid=FAZN__20170810_5144663	2017-08-10	"Nach Angaben der Internationalen Organisation für Migration (IOM) sind vor der Küste des Jemen mindestens 29 Flüchtlinge ums Leben gekommen. ...
         ..Nach Angaben der Internationalen Organisation für Migration (IOM) sind vor der Küste des Jemen mindestens 29 Flüchtlinge.."		Drama vor Küste Jemens	FAZ
Land am Abgrund	https://www.faz-biblionet.de/faz-portal/document?uid=FAZ__FD1201707255191633	2017-07-25	"So rasch wie derzeit im Jemen hat sich noch nirgends die Cholera ausgebreitet. Ausgebrochen war sie Ende April, drei Monate später sind bereits ...
         ..So rasch wie derzeit im Jemen hat sich noch nirgends die Cholera ausgebreitet...  ..Bisher sind im Jemen 1800 Menschen an der Krankheit gestorben...  ..Zusätzlich kompliziert die Qatar-Krise den Krieg im Jemen..."		Im Jemen breitet sich die Cholera schneller aus als bei allen früheren Epidemien / Von Rainer Hermann	FAZ
Die Epidemie, die das Land ins Chaos stürzt	https://www.faz-biblionet.de/faz-portal/document?uid=FAZN__20170724_5120224	2017-07-24	"So rasch wie derzeit im Jemen hat sich noch nirgends die Cholera ausgebreitet. Ausgebrochen war sie Ende April, drei Monate später sind bereits ...
         ..So rasch wie derzeit im Jemen hat sich noch nirgends die Cholera ausgebreitet...  ..Bisher sind im Jemen 1800 Menschen an der Krankheit gestorben...  ..Zusätzlich kompliziert die Qatar-Krise den Krieg im Jemen..."	Rainer Hermann	Cholera im Jemen	FAZ
Tote bei Luftangriff im Jemen	https://www.faz-biblionet.de/faz-portal/document?uid=FAZ__FD2201707205188446_7	2017-07-20	"Bei einem Luftangriff der saudi-arabisch geführten Militärkoalition im Jemen sind mindestens 20 Zivilisten getötet worden. Unter den Opfern ...
         ..Bei einem Luftangriff der saudi-arabisch geführten Militärkoalition im Jemen sind mindestens 20 Zivilisten getötet worden.."		Wichtiges in Kürze	FAZ
Ringen um Hilfe für Jemen	https://www.faz-biblionet.de/faz-portal/document?uid=FAZ__FD1202006036013518_2	2020-06-03	"Wegen ausbleibender Spendengelder droht 30 der 41 wichtigsten UN-Hilfsprogramme im Jemen in wenigen Wochen das Aus. ""Wir hatten noch nie so ...
         ..Wegen ausbleibender Spendengelder droht 30 der 41 wichtigsten UN-Hilfsprogramme im Jemen in wenigen Wochen das Aus...  ..""Wir hatten noch nie so wenig Geld für Hilfseinsätze im Jemen zu diesem Zeitpunkt im Jahr"", sagte UN-Generalsekretär António..  ..Guterres am Dienstag zum Auftakt einer virtuellen Geberkonferenz für den Jemen..."		Wichtiges in Kürze	FAZ
Jemens Regierung hält nichts von Corona-Statistiken	https://www.faz-biblionet.de/faz-portal/document?uid=FAZN__20200603_6798980	2020-06-03	"Da ist zum Beispiel die Geschichte mit dem alten Mann in Sanaa, der sich nach einem Streit mit seinem Sohn wutentbrannt zu Fuß auf den Weg ins ...
         ..Im Jemen breitet sich nicht nur das Coronavirus mit zunehmender Geschwindigkeit aus...  ..UN-Hilfsorganisationen warnen schon länger vor einem Massensterben, sollte die Corona-Pandemie den Jemen erfassen...  ..Im Süden des Jemen bekriegen sich auch die Regierung Hadis und Sezessionisten weiter..."	Christoph Ehrhardt	UN warnen vor Massensterben	FAZ
Riad weist Separatisten zurück	https://www.faz-biblionet.de/faz-portal/document?uid=FAZN__20200427_6743501	2020-04-27	"Im Jemen-Konflikt hat die von Saudi-Arabien angeführte Militärkoalition die Autonomie-Erklärung von Separatisten in der strategisch wichtigen ...
         ..Im Jemen-Konflikt hat die von Saudi-Arabien angeführte Militärkoalition die Autonomie-Erklärung von Separatisten in der strategisch.."		Krieg im Jemen	FAZ
Der Krieg im Jemen eskaliert	https://www.faz-biblionet.de/faz-portal/document?uid=FAZ__FD1202004275989123	2020-04-27	"Die saudischen Soldaten wirkten nicht sonderlich schockiert. Sie posierten sogar fröhlich auf einem Erinnerungsbild. Milizionäre der südjemenitischen ...
         ..freundliche Bilder von den Sezessionisten verbreitet wurden, eine Eskalation des seit fünf Jahren andauernden Kriegs im Jemen..  ..Sie sucht eigentlich einen gesichtswahrenden Ausweg aus der Intervention im Jemen, die sie vor fünf Jahren begonnen hat..."		Allianz gegen Houthi zerbricht und neue Front im Süden / Von Christoph Ehrhardt	FAZ
Eskalation in Zeiten von Flut und Seuchen	https://www.faz-biblionet.de/faz-portal/document?uid=FAZN__20200426_6742983	2020-04-26	"Die saudischen Soldaten wirkten nicht sonderlich schockiert. Sie posierten sogar fröhlich auf einem Erinnerungsbild. Milizionäre der südjemenitischen ...
         ..freundliche Bilder von den Sezessionisten verbreitet wurden, eine Eskalation des seit fünf Jahren andauernden Kriegs im Jemen..  ..Sie sucht eigentlich einen gesichtswahrenden Ausweg aus der Intervention im Jemen, die sie vor fünf Jahren begonnen hat..."	Christoph Ehrhardt	Krieg im Jemen	FAZ
Warnung vor drohender Ölpest vor Jemen	https://www.faz-biblionet.de/faz-portal/document?uid=FAZN__20220510_8018714	2022-05-10	"Seit Jahren liegt der 45 Jahre alte Öltanker ""FAS Safer"" vor der Küste Jemens. Experten warnen nun vor einem Auseinanderbrechen des Schiffes ...
         ..Die UN hat vor Milliardenkosten gewarnt, falls ein vor der Küste des Jemen aufgegebener Öltanker zerbricht...  ..Der UN-Koordinator für humanitäre Hilfe im Jemen, David Gressly, warnte am Montag, dass ein jüngster Besuch mit technischen..  ..Die UNO betrachtet die Krise im Jemen als größte humanitäre Katastrophe weltweit.

AFP.."		Umweltkatastrophe	FAZ
Ramstein vor Gericht	https://www.faz-biblionet.de/faz-portal/document?uid=FAZE__fazein_222425	2019-03-20	DÜSSELDORF, 19. März. Schon seit einigen Jahren befassen sich Gerichte mit der Frage, ob die Bundesrepublik Deutschland eine Mitverantwortung ...		<header>Drei Kläger aus dem Jemen sind mit ihrer Klage gegen den amerikanischen Drohnenkrieg gescheitert, aber das OVG Münster hat Deutschland ...	FAZ
Senat stimmt für Resolution zum Jemen-Krieg	https://www.faz-biblionet.de/faz-portal/document?uid=FAZ__FD1201903155661615	2019-03-15	"cheh. BEIRUT, 14. März. Der amerikanische Senat hat den Druck auf Präsident Donald Trump erhöht, die Unterstützung für den Kriegseinsatz der ...
         ..den Druck auf Präsident Donald Trump erhöht, die Unterstützung für den Kriegseinsatz der saudisch geführten Koalition im Jemen..  ..Bei dem Streit geht es nicht nur um den ruinösen Abnutzungskrieg im Jemen, der das Land in eine humanitäre Katastrophe gestürzt..  ..Muhammad Bin Salman gilt als die treibende Kraft hinter dem saudischen Jemen-Engagement gegen die von Iran geförderten Houthi-Rebellen.."			FAZ
Senat stimmt für Resolution zum Jemen-Krieg	https://www.faz-biblionet.de/faz-portal/document?uid=FAZE__fazein_220189	2019-03-15	"cheh. BEIRUT, 14. März. Der amerikanische Senat hat den Druck auf Präsident Donald Trump erhöht, die Unterstützung für den Kriegseinsatz der ...
         ..den Druck auf Präsident Donald Trump erhöht, die Unterstützung für den Kriegseinsatz der saudisch geführten Koalition im Jemen..  ..Bei dem Streit geht es nicht nur um den ruinösen Abnutzungskrieg im Jemen, der das Land in eine humanitäre Katastrophe gestürzt..  ..Muhammad Bin Salman gilt als die treibende Kraft hinter dem saudischen Jemen-Engagement gegen die von Iran geförderten Houthi-Rebellen.."		Amerika	FAZ
Senat stimmt für Ende der Beteiligung am Jemen-Krieg	https://www.faz-biblionet.de/faz-portal/document?uid=FAZN__20190314_6088111	2019-03-14	"Der Senat hat Präsident Donald Trump zur Beendigung der Zusammenarbeit mit Saudi-Arabien im jemenitischen Bürgerkrieg aufgefordert. Die Vereinigten ...
         ..Die Vereinigten Staaten sollen ihre militärische Unterstützung für die von Riad geführte Koalition im Jemen-Krieg einstellen..  ..Im Jemen herrscht seit 2014 ein Krieg zwischen den vom Iran unterstützten Huthi-Rebellen und den von Saudi-Arabien und anderen..  ..Eine Zeit lang halfen sie auch bei der Luftbetankung von Kampfflugzeugen im Jemen-Einsatz.

AFP

AFP.."		Vereinigte Staaten	FAZ
Regierung erlaubt deutlich mehr Waffenexporte	https://www.faz-biblionet.de/faz-portal/document?uid=FAZ__FD2201907125756236	2019-07-12	"ufe. FRANKFURT, 11. Juli. Deutschlands Waffenexporte steigen kräftig. Nach einem niedrigen Niveau im vergangenen Jahr hat die Bundesregierung ...
         ..Beide Staaten sind Mitglieder der von Saudi-Arabien geführten Allianz, die schon seit Jahren im Jemen Krieg gegen die Houthi-Rebellen..  ..Versprechen, Kriegsparteien nicht mit Rüstungsgütern zu beliefern, und ist mitschuldig an Tod und Leid der Menschen im Jemen..  ..bestehen, dass endmontierte Güter nicht an Saudi-Arabien oder die Vereinigten Arabischen Emirate geliefert werden und damit im Jemen-Krieg.."		Auch in den Jemen-Krieg verstrickte Staaten profitieren	FAZ
Diskreter Ausweg	https://www.faz-biblionet.de/faz-portal/document?uid=FAZ__FD1N201907095754040	2019-07-09	"BEIRUT, 8. Juli /  / Die zeitliche Nähe ist bemerkenswert: Als Ende vergangener Woche eine Rakete der jemenitischen Houthi-Rebellen auf dem Anwesen ...
         ..hatten gerade Berichte Aufsehen erregt, denen zufolge die Vereinigten Arabischen Emirate in großem Stil Truppen aus dem Jemen..  ..Sicherheitsfachleute im Jemen beobachten ebenfalls seit vielen Wochen, wie das emiratische Militär Soldaten und Gerät in..  ..Die Emirate verfolgen im Jemen eigene Interessen, und es gibt Konflikte mit Riad..."		Was der Rückzug der Vereinigten Arabischen Emirate für den Jemen-Krieg bedeutet / Von Christoph Ehrhardt	FAZ
Ein Toter bei Angriff auf saudischen Flughafen	https://www.faz-biblionet.de/faz-portal/document?uid=FAZN__20190624_6250954	2019-06-24	"Bei einem Angriff der jemenitischen Houthi-Rebellen auf einen Flughafen im benachbarten Saudi-Arabien sind nach Militärangaben am Sonntag ein ...
         ..von tausenden Passagieren genutzt werde, erklärte ein Sprecher der von Saudi-Arabien angeführten Militärkoalition, die im Jemen..  ..Im Jemen herrscht seit 2015 Krieg zwischen den von Saudi-Arabien und anderen arabischen Staaten unterstützten Truppen von.."		Jemen-Krieg	FAZ
Rüstungsgüter für eine Milliarde Euro an Jemen-Kriegsallianz	https://www.faz-biblionet.de/faz-portal/document?uid=FAZN__20190616_6239017	2019-06-16	"Die Bundesregierung hat seit Jahresanfang Rüstungslieferungen für mehr als eine Milliarde Euro an die von Saudi-Arabien geführte Allianz im ...
         ..hat seit Jahresanfang Rüstungslieferungen für mehr als eine Milliarde Euro an die von Saudi-Arabien geführte Allianz im Jemen-Krieg.."		An Ägypten und andere	FAZ
Gouverneur von Aden getötet	https://www.faz-biblionet.de/faz-portal/document?uid=FAZ__FD1201512074736032	2015-12-07	"Her. BEIRUT, 6. Dezember. Mit der Ermordung des Gouverneurs von Aden durch eine Autobombe ist am Sonntag die Gewalt in der jemenitischen Hafenstadt ...
         ..Saad war erst Anfang 2015 auf Bitten Hadis in den Jemen zurückgekehrt...  ..Hadi hatte am Samstag in Aden Gespräche mit dem Beauftragten der UN für den Jemen über die Aufnahme möglicher Friedensgespräche..  ..im Jemen geführt..."		Gewalt im Jemen eskaliert weiter / IS der Tat bezichtigt	FAZ
Hilfsgelder für den Jemen	https://www.faz-biblionet.de/faz-portal/document?uid=FAZ__FD3201902275647555_3	2019-02-27	"Bei der Geberkonferenz für das Bürgerkriegsland Jemen sind in Genf am Dienstag 2,6 Milliarden Dollar an Spenden zugesagt worden (rund 2,3 Milliarden ...
         ..Bei der Geberkonferenz für das Bürgerkriegsland Jemen sind in Genf am Dienstag 2,6 Milliarden Dollar an Spenden zugesagt..  ..Allerdings brauchen die Vereinten Nationen dieses Jahr 4,2 Milliarden Dollar für den Jemen..."		Wichtiges in Kürze	FAZ
Widerstand gegen Amerikas Hilfe für Saudi-Arabien	https://www.faz-biblionet.de/faz-portal/document?uid=FAZN__20190214_6040521	2019-02-14	"Das amerikanische Abgeordnetenhaus hat ein Ende der militärischen Unterstützung für den Krieg der saudisch-geführten Koalition im Jemen gefordert. ...
         ..amerikanische Abgeordnetenhaus hat ein Ende der militärischen Unterstützung für den Krieg der saudisch-geführten Koalition im Jemen..  ..Die von Saudi-Arabien geführte Militärkoalition unterstützt die sunnitische Regierung im Jemen, die gegen die wiederum von.."		Krieg im Jemen	FAZ
Vereinte Nationen verlangen Zugang zu Getreide-Silos	https://www.faz-biblionet.de/faz-portal/document?uid=FAZN__20190208_6030763	2019-02-08	"UN-Nothilfekoordinator Mark Lowcock drängt auf raschen Zugang zu Lebensmittelhilfen für Millionen hungernde Menschen im Krisenstaat Jemen. In ...
         ..UN-Nothilfekoordinator Mark Lowcock drängt auf raschen Zugang zu Lebensmittelhilfen für Millionen hungernde Menschen im Krisenstaat Jemen..  ..Im Jemen bekämpfen sich seit Jahren Regierungstruppen und schiitische Houthi-Rebellen, die von Iran unterstützt werden. 2015..  ..Die Menschen im Jemen erleben nach Angaben der Vereinten Nationen (UN) die schwerste humanitäre Krise der Welt..."		Krieg im Jemen	FAZ
Westliche Waffen im Jemen	https://www.faz-biblionet.de/faz-portal/document?uid=FAZ__FD2201902075631468_6	2019-02-07	"Der Kommandant der amerikanischen Streitkräfte im Mittleren Osten fordert eine Klärung der Vorwürfe, Milizen im Bürgerkriegsland Jemen begingen ...
         ..Kommandant der amerikanischen Streitkräfte im Mittleren Osten fordert eine Klärung der Vorwürfe, Milizen im Bürgerkriegsland Jemen..  ..Import-Waffen aus westlichen Staaten wie Deutschland oder den Vereinigten Staaten ohne Genehmigung an verbündete Milizen im Jemen-Krieg.."		Wichtiges in Kürze	FAZ
Der Jemen liegt in Trümmern	https://www.faz-biblionet.de/faz-portal/document?uid=FAS__SD1201702055057539	2017-02-05	"Besonders leiden die Kinder. Väter suchen im Müll nach Essen für sie. Oft finden sie nichts. Hilfsgüter erreichen sie nur selten. /  / Von Rainer ...
         ..Von Rainer Hermann

Die Bilder aus dem Jemen sind alarmierend...  ..Er war von 1978 bis zu seinem erzwungenen Rücktritt 2012 Präsident des Jemen...  ..In den vergangenen zwei Jahren haben saudische Kampfflugzeuge 90 000 Einsätze im Jemen geflogen..."			FAZ
Pentagon veröffentlicht altes Video von Al Qaida	https://www.faz-biblionet.de/faz-portal/document?uid=FAZN__20170204_4841696	2017-02-04	"Nach einer umstrittenen Kommandoaktion des amerikanischen Militärs im Jemen ist dem Pentagon eine Panne unterlaufen. Das Verteidigungsministerium ...
         ..Nach einer umstrittenen Kommandoaktion des amerikanischen Militärs im Jemen ist dem Pentagon eine Panne unterlaufen..."		Nach Operation im Jemen	FAZ
Städte im Südjemen erobert	https://www.faz-biblionet.de/faz-portal/document?uid=FAZ__FD2201702045057785_3	2017-02-04	"Das Terrornetzwerk Al Qaida hat im Jemen nach Angaben eines Regierungsmitarbeiters zwei Städte zurückerobert. Die Extremisten hätten die Städte ...
         ..Das Terrornetzwerk Al Qaida hat im Jemen nach Angaben eines Regierungsmitarbeiters zwei Städte zurückerobert...  ..Der Al-Qaida-Ableger im Jemen gilt als eine der aktivsten Terrorgruppen weltweit..."		Wichtiges in Kürze	FAZ
Militär bedauert zivile Opfer bei Angriff im Jemen	https://www.faz-biblionet.de/faz-portal/document?uid=FAZN__20170202_4821131	2017-02-02	"Bei einem Einsatz von amerikanischen Spezialkräften gegen Stellungen des Terrornetzwerkes Al Qaida im Jemen sind am vergangenen Wochenende nach ...
         ..Bei einem Einsatz von amerikanischen Spezialkräften gegen Stellungen des Terrornetzwerkes Al Qaida im Jemen sind am vergangenen..  ..Das amerikanische Militär hatte zuvor mitgeteilt, dass bei dem Einsatz im Jemen 14 Kämpfer der Al Qaida getötet worden seien.."		Kampf gegen Al Qaida	FAZ
Noch mehr Gegenwind für Trumps Einreiseverbot	https://www.faz-biblionet.de/faz-portal/document?uid=FAZN__20170202_4823379	2017-02-02	"Der amerikanische Präsident Donald Trump bekommt nach der Verhängung des Einreisestopps für Muslime weiteren Gegenwind aus der Justiz. Ein Bundesrichter ...
         ..Jemen gehört zu den insgesamt sieben Staaten, aus denen Trump in der vergangenen Woche die Einreise massiv erschwert hatte..  ..Dekret ordnete er an, dass Bürger aus den mehrheitlich muslimischen Staaten Irak, Iran, Libyen, Somalia, Sudan, Syrien und Jemen.."		Jemeniten klagen mit Erfolg	FAZ
Iran wirft Saudi-Arabien Raketenangriff auf Botschaft vor	https://www.faz-biblionet.de/faz-portal/document?uid=FAZN__20160107_4001991	2016-01-07	"Der Konflikt zwischen Saudi-Arabien und dem Iran eskaliert weiter. Der Iran warf dem Königreich am Donnerstag vor, im Jemen seine Botschaft ...
         ..Der Iran warf dem Königreich am Donnerstag vor, im Jemen seine Botschaft mit Kampfflugzeugen angegriffen zu haben...  ..Im Jemen liefern sich die beiden Regionalmächte, die auch im Syrien-Konflikt konkurrieren, einen Stellvertreterkrieg...  ..Saudi-Arabien geführte Allianz sunnitischer Staaten, die gegen die vom Iran unterstützten schiitischen Huthi-Rebellen im Jemen.."		Jemen	FAZ
