title	link	date	abstract	author	surtitle	source
Pompeo: Beispielloser Angriff Irans auf die Welt-Energieversorgung	https://www.faz-biblionet.de/faz-portal/document?uid=FAZ__FD2201909165808920	2019-09-16	"cheh./sat. BEIRUT/WASHINGTON, 15. September. Angriffe auf Ölanlagen in Saudi-Arabien haben zu einer Eskalation der Lage am Persischen Golf geführt. ...
         ..Obwohl die Houthi-Rebellen im Jemen die Tat für sich reklamierten, machte Washington Iran verantwortlich, den Verbündeten..  ..Es gibt keinen Beweis, dass die Angriffe vom Jemen kamen.""

Teheran bestritt jegliche Beteiligung...  ..Iran die Schuld zu geben werde das ""Desaster"" im Jemen nicht beenden, äußerte er..."		Raffinerie in Saudi-Arabien getroffen / Houthi-Rebellen aus dem Jemen bekennen sich	FAZ
Viele Tote nach Raketenangriff im Jemen	https://www.faz-biblionet.de/faz-portal/document?uid=FAZ__FD1202001205912944_1	2020-01-20	"Bei einem Raketenangriff im Jemen sind mehr als 80 Regierungssoldaten getötet worden. Die Rakete schlug nach Angaben aus Militärkreisen am Samstag ...
         ..Bei einem Raketenangriff im Jemen sind mehr als 80 Regierungssoldaten getötet worden..."		Wichtiges in Kürze	FAZ
Mindestens 60 Tote nach Angriff auf Trainingscamp	https://www.faz-biblionet.de/faz-portal/document?uid=FAZN__20200119_6589324	2020-01-19	"Bei einem Angriff auf ein militärisches Trainingscamp im Jemen in der Stadt Marib sind mindestens 60 Menschen getötet und Dutzende verletzt ...
         ..Bei einem Angriff auf ein militärisches Trainingscamp im Jemen in der Stadt Marib sind mindestens 60 Menschen getötet und..  ..Der Jemen ist eines der ärmsten Länder der arabischen Welt..."		Jemen	FAZ
Ein umfassender Schlag gegen Irans militärische Fähigkeiten?	https://www.faz-biblionet.de/faz-portal/document?uid=FAZ__FD1N202001135907095	2020-01-13	"sat./cheh./stah. WASHINGTON/BEIRUT/TEL AVIV. Die amerikanische Regierung zeigte sich am Wochenende zugeknöpft. Im Pentagon hieß es, über streng ...
         ..Bestätigt wurde nur, dass der Jemen ein Rückzugsgebiet für Terroristen und andere Feinde Amerikas sei...  ..Er habe sich zum Zeitpunkt des geplanten Angriffs zu einer geheimen Mission im Jemen aufgehalten...  ..Im Jemen fördert Teheran die schiitischen Houthi-Rebellen, die mit einer saudisch geführten Militärkampagne konfrontiert.."		Washington schweigt zu Berichten über eine fehlgeschlagene Operation im Jemen	FAZ
UN: Angriff auf saudische Ölanlagen nicht aus Jemen	https://www.faz-biblionet.de/faz-portal/document?uid=FAZ__FD1202001105905096_3	2020-01-10	"Die Houthi-Rebellen im Jemen sind laut Fachleuten der Vereinten Nationen (UN) entgegen eigener Darstellung nicht für Angriffe auf Ölanlagen ...
         ..Die Houthi-Rebellen im Jemen sind laut Fachleuten der Vereinten Nationen (UN) entgegen eigener Darstellung nicht für Angriffe..  ..Die Reichweite der eingesetzten Drohnen und Raketen sei nicht so groß, als dass die Geschosse aus dem Houthi-Gebiet im Jemen..  ..hätten abgeschossen werden können, heißt es in einem vertraulichen Bericht eines UN-Jemen-Komitees..."		Wichtiges in Kürze	FAZ
Zahl der Cholera-Opfer im Jemen steigt stark an	https://www.faz-biblionet.de/faz-portal/document?uid=FAW__FW201705265144977	2017-05-26	"Die Zahl der Cholera-Opfer im Jemen steigt stark an. Die Weltgesundheitsorganisation (WHO) meldete, mittlerweile seien knapp 30 000 Verdachtsfälle ...
         ..Die Zahl der Cholera-Opfer im Jemen steigt stark an...  ..Im Jemen tobt seit drei Jahren ein Bürgerkrieg..."		KRANKHEIT	FAZ
Warum die Houthi-Rebellen es Biden im Jemen schwer machen	https://www.faz-biblionet.de/faz-portal/document?uid=FAZN__20210208_7187367	2021-02-08	"Den Tag, an dem Martin Griffiths, der UN-Sondergesandte für den Jemen, nach Iran reiste, verschärften die von Teheran unterstützten Houthi-Rebellen ...
         ..Den Tag, an dem Martin Griffiths, der UN-Sondergesandte für den Jemen, nach Iran reiste, verschärften die von Teheran unterstützten..  ..Er hat die amerikanische Unterstützung für den saudisch geführten Angriffskrieg im Jemen eingestellt und den Vorstoß der..  ..Nach fast sechs Jahren eines erfolgsarmen Feldzugs, der den Jemen in eine dramatische humanitäre Krise gestürzt hat, gibt.."	Christoph Ehrhardt	Jemen-Konflikt	FAZ
Neue diplomatische Initiative zu Jemen	https://www.faz-biblionet.de/faz-portal/document?uid=FAZ__FD2202102086187195	2021-02-08	"sat. WASHINGTON. Nach der Ankündigung des amerikanischen Präsidenten Joe Biden, die Unterstützung der saudisch geführten Allianz im Jemen-Krieg ...
         ..Nach der Ankündigung des amerikanischen Präsidenten Joe Biden, die Unterstützung der saudisch geführten Allianz im Jemen-Krieg..  ..Der UN-Sonderbeauftragte Martin Griffiths reiste nach Iran, das die Houthi-Rebellen im Jemen unterstützt...  ..Eine Deeskalation im Jemen könnte aus amerikanischer Sicht Teheran auch einen Weg zurück an den Verhandlungstisch mit dem.."		UN-Sonderbeauftragter reist nach Iran / Amerika: Houthi nicht länger Terroristen	FAZ
Amerika will Hilfe für Riad im Jemen einstellen	https://www.faz-biblionet.de/faz-portal/document?uid=FAZ__FD3N202102056185896	2021-02-05	"sat. WASHINGTON. Die Vereinigten Staaten wollen ihre Unterstützung für die saudisch geführte Koalition im Jemen-Krieg einstellen. Präsident ...
         ..Die Vereinigten Staaten wollen ihre Unterstützung für die saudisch geführte Koalition im Jemen-Krieg einstellen...  ..Washington hatte Riad seit 2015 im Jemen militärisch unterstützt..."			FAZ
Raketen über Riad	https://www.faz-biblionet.de/faz-portal/document?uid=FAZ__FD1202101276178451	2021-01-27	"Von Christoph Ehrhardt, Beirut /  / Die internationale Kritik an den Raketenangriffen auf Saudi-Arabien war kaum verklungen, da krachte es am Dienstag ...
         ..Erst am Samstag hatte die von Saudi-Arabien geführte Koalition, die im Jemen einen Krieg gegen die Houthi-Rebellen führt,..  ..Das Auswärtige Amt teilte in der vergangenen Woche mit, Deutschland habe dem UN-Welternährungsprogramm für den Jemen zusätzlich..  ..Der UN-Sondergesandte Martin Griffiths sagte Mitte Januar im Sicherheitsrat, Frieden im Jemen zu erreichen sei ""jetzt ein.."		Houthi demonstrieren Stärke im Jemen-Krieg	FAZ
Neue Kämpfe und alte Probleme im Jemen-Krieg	https://www.faz-biblionet.de/faz-portal/document?uid=FAZN__20210126_7166013	2021-01-26	"Die internationale Kritik an den Raketenangriffen auf Saudi-Arabien war kaum verklungen, da krachte es am Dienstag wieder am Himmel über der ...
         ..Erst am Samstag hatte die von Saudi-Arabien geführte Koalition, die im Jemen einen Krieg gegen die Houthi-Rebellen führt,..  ..Das Auswärtige Amt teilte in der vergangenen Woche mit, Deutschland habe dem UN-Welternährungsprogramm für den Jemen zusätzlich..  ..Der UN-Sondergesandte Martin Griffiths sagte Mitte Januar im Sicherheitsrat, Frieden im Jemen zu erreichen sei ""jetzt ein.."	Christoph Ehrhardt	Raketenbeschuss auf Riad	FAZ
UN-Gesandter verurteilt Angriff im Jemen	https://www.faz-biblionet.de/faz-portal/document?uid=FAZ__FD1202101026161411_8	2021-01-02	"Der UN-Jemen-Beauftragte Martin Griffiths hat die schwere Explosion auf dem Flughafen der südjemenitischen Stadt Aden als ""verabscheuenswürdigen ...
         ..Der UN-Jemen-Beauftragte Martin Griffiths hat die schwere Explosion auf dem Flughafen der südjemenitischen Stadt Aden als.."		Wichtiges in Kürze	FAZ
Schwere Explosion im Jemen	https://www.faz-biblionet.de/faz-portal/document?uid=FAZ__FD1202012316160569_3	2020-12-31	Auf dem Flughafen der jemenitischen Stadt Aden ist es am Mittwoch zu einer schweren Explosion gekommen. Der Vorfall ereignete sich Zeugenberichten ...		Wichtiges in Kürze	FAZ
Anschlag auf neue Regierung Jemens	https://www.faz-biblionet.de/faz-portal/document?uid=FAZN__20201230_7124390	2020-12-30	"Das neu gebildete Regierungskabinett im Jemen ist offenbar einem Anschlag entgangen. Eine heftige Explosion erschütterte am Mittwoch den Flughafen ...
         ..Das neu gebildete Regierungskabinett im Jemen ist offenbar einem Anschlag entgangen...  ..Im vielschichtigen Konflikt im Jemen sind auch Ableger der Terrorgruppen Al-Kaida und Islamischer Staat aktiv...  ..Der UN-Sondergesandte für den Jemen, Martin Griffiths, sprach von einer inakzeptablen Gewalttat..."		Explosion in Aden	FAZ
Erschöpfung lässt hoffen	https://www.faz-biblionet.de/faz-portal/document?uid=FAZ__FD2201912045876992	2019-12-04	"Lt. BERLIN. Der frühere britische Außenminister David Miliband, der jetzt als Präsident die Hilfsorganisation International Rescue Committee ...
         ..Hilfsorganisation International Rescue Committee (IRC) führt, hat eindringlich an die westliche Welt und die Kriegsparteien im Jemen..  ..Die Amerikaner richteten ihr Augenmerk gegenwärtig nicht auf den Jemen; auch die Houthi könnten an den Protesten in Iran..  ..Der IRC-Präsident warnte, der Jemen könne zu einem ""Aushängeschild für das Zeitalter der Straflosigkeit werden""..."		Warnungen vor den Folgen des Krieges im Jemen	FAZ
Zaghafte Hoffnung im Jemen	https://www.faz-biblionet.de/faz-portal/document?uid=FAZ__FD1201911075854985	2019-11-07	"Es war ein Bild der Einigkeit, das sie abgeben wollten. Die starken Männer vom Golf nehmen das schwache Staatsoberhaupt des kriegsversehrten ...
         ..""Dieses Abkommen wird eine neue Phase der Stabilität im Jemen eröffnen"", verkündete der saudische Thronfolger...  ..Es bietet allerdings nur den Ausweg aus einem der Konflikte im Jemen...  ..Die Führung in Abu Dhabi ist sowohl Hadis als auch des Einsatzes im Jemen überdrüssig..."		Was das Friedensabkommen für die Konflikte im Land bedeutet / Von Christoph Ehrhardt, Beirut	FAZ
Friedensplan für den Jemen	https://www.faz-biblionet.de/faz-portal/document?uid=FAZ__FD2201911065854342_11	2019-11-06	"Die international anerkannte Regierung des Jemens und der separatistische Südliche Übergangsrat (STC) im Süden des Bürgerkriegslandes haben ...
         ..Die Einigung sei ein wichtiger Schritt, um bei einer friedlichen Lösung des Jemen-Konflikts voranzuschreiten, teilte der..  ..UN-Sondergesandte für den Jemen, Martin Griffiths, am Dienstag mit..."			FAZ
Was ist das Friedensabkommen von Riad wert?	https://www.faz-biblionet.de/faz-portal/document?uid=FAZN__20191106_6471527	2019-11-06	"Es war ein Bild der Einigkeit, das sie gerne abgeben wollten. Die starken Männer vom Golf nehmen das schwache Staatsoberhaupt des kriegsversehrten ...
         ..Die starken Männer vom Golf nehmen das schwache Staatsoberhaupt des kriegsversehrten Jemen in ihre Mitte...  ..Allerdings eröffnet die Übereinkunft nur den Ausweg aus einem der Konflikte, die den Jemen verheeren...  ..Die Führung in Abu Dhabi ist sowohl Hadi als auch des Einsatzes im Jemen überdrüssig..."	Christoph Ehrhardt	Krieg im Jemen	FAZ
Regierung und Separatisten einigen sich	https://www.faz-biblionet.de/faz-portal/document?uid=FAZN__20191105_6470228	2019-11-05	"Die international anerkannte Regierung des Jemens und Separatisten im Süden des Bürgerkriegslandes haben sich nach monatelangen Kämpfen auf ...
         ..Die Einigung sei ein wichtiger Schritt, um bei einer friedlichen Lösung des Jemen-Konflikts voranzuschreiten, teilte der..  ..UN-Sondergesandte für den Jemen, Martin Griffiths, am Dienstag mit...  ..Arabischen Emirate die Hafenstadt Aden überrannt und damit eine neue Front in dem seit Jahren andauernden Bürgerkrieg im Jemen.."		Bürgerkrieg im Jemen	FAZ
Mehr als 140 Tote im Jemen	https://www.faz-biblionet.de/faz-portal/document?uid=FAZ__FD2201610104967884	2016-10-10	"Her. FRANKFURT, 9. Oktober. Im Jemen sind bei einem der blutigsten Angriffe seit 18 Monaten am Samstag in der Hauptstadt Sanaa mindestens 140 ...
         ..Im Jemen sind bei einem der blutigsten Angriffe seit 18 Monaten am Samstag in der Hauptstadt Sanaa mindestens 140 Menschen..  ..Shahadi war der ranghöchste Militär der von Saudi-Arabien unterstützten Truppen im Jemen, der im Krieg getötet wurde...  ..Der Krieg im Jemen hatte im September 2014 begonnen, als Houthi-Milizen Sanaa eroberten..."		Kritik aus Washington / Riad bestreitet Verantwortung	FAZ
Jemenitische Tragödie	https://www.faz-biblionet.de/faz-portal/document?uid=FAZ__FD1201610104967868	2016-10-10	"Die Welt blickt ohnmächtig auf die Zerstörung von Aleppo, und sie kann nicht dem Zerfall von Staaten Einhalt gebieten, nicht von Syrien und ...
         ..Kaum wahrgenommen wird jedoch eine weitere Tragödie, die nicht minder grausam ist: der Krieg im Jemen; hier wird das ohnehin.."			FAZ
Jemenitischer Abnutzungskrieg	https://www.faz-biblionet.de/faz-portal/document?uid=FAZ__FD2201610084966933	2016-10-08	"Verhandlungen über einen Waffenstillstand oder gar über einen Frieden kommen nicht voran. Stattdessen gibt es neue Provokationen. /  / Von Christoph ...
         ..Der Chef des UN-Nothilfebüros, Stephen O'Brien, zeigte sich am Dienstag nach einem Besuch im Jemen zutiefst schockiert angesichts.."			FAZ
Selbstmordattentäter tötet in Jemen 30 Menschen	https://www.faz-biblionet.de/faz-portal/document?uid=FAZN__20160829_4410715	2016-08-29	"Bei einem Selbstmordanschlag mit einer Autobombe auf ein Rekrutierungszentrum der Armee hat ein Attentäter im Süden des Jemens mehr als 30 Menschen ...
         ..Im Jemen tobt seit rund zwei Jahren ein Bürgerkrieg..."		Vor Rekrutierungsstelle	FAZ
Große Opfer, wenig Erfolge	https://www.faz-biblionet.de/faz-portal/document?uid=FAZ__FD1201608174926833	2016-08-17	"Von Christoph Ehrhardt /  / BEIRUT, 16. August. Wieder einmal zeigt sich die internationale Gemeinschaft besorgt. UN-Generalsekretär Ban Ki-moon ...
         ..UN-Generalsekretär Ban Ki-moon musste abermals seiner Sorge über die Gewalteskalation im Jemen Ausdruck verleihen...  ..Washington unterstützt den saudischen Jemen-Feldzug gegen die von Iran unterstützten Houthi-Rebellen, die 2014 die Hauptstadt..  ..Saudische Regierungsmitarbeiter geben schon länger - wenn auch zögerlich - zu, dass der Krieg im Jemen große Opfer fordert.."		Die UN sind besorgt über neue Luftangriffe im Jemen	FAZ
Tote bei Luftangriff auf Krankenhaus	https://www.faz-biblionet.de/faz-portal/document?uid=FAZN__20160816_4390190	2016-08-16	"Bei einem Luftangriff auf ein Krankenhaus im Jemen sind nach einer Mitteilung der Hilfsorganisation Ärzte ohne Grenzen mindestens elf Menschen ...
         ..Bei einem Luftangriff auf ein Krankenhaus im Jemen sind nach einer Mitteilung der Hilfsorganisation Ärzte ohne Grenzen mindestens..  ..Flughafen soll geöffnet werden

Der seit Anfang 2014 andauernde Konflikt im Jemen verschärft sich, seit die Friedensgespräche..  ..Der Jemen im Süden der Arabischen Halbinsel gehört zu den ärmsten Ländern der arabischen Welt..."		Jemen	FAZ
Große Opfer, wenig Erfolge	https://www.faz-biblionet.de/faz-portal/document?uid=FAZN__20160816_4391304	2016-08-16	"Wieder einmal zeigt sich die internationale Gemeinschaft besorgt. UN-Generalsekretär Ban Ki-moon musste abermals seiner Sorge über die Gewalteskalation ...
         ..UN-Generalsekretär Ban Ki-moon musste abermals seiner Sorge über die Gewalteskalation im Jemen Ausdruck verleihen...  ..Washington unterstützt den saudischen Jemen-Feldzug gegen die von Iran unterstützten Houthi-Rebellen, die 2014 die Hauptstadt..  ..Saudische Regierungsmitarbeiter geben schon länger - wenn auch zögerlich - zu, dass der Krieg im Jemen große Opfer fordert.."	Christoph Ehrhardt	Luftangriffe in Jemen	FAZ
Wieder Luftangriffe im Jemen	https://www.faz-biblionet.de/faz-portal/document?uid=FAZ__FR1201608104920465_5	2016-08-10	Erstmals seit drei Monaten hat die arabische Militärkoalition wieder Angriffe auf Stellungen der Houthi-Rebellen in der jemenitischen Hauptstadt ...		Wichtiges in Kürze	FAZ
Jemeniten freigelassen	https://www.faz-biblionet.de/faz-portal/document?uid=FAZ__FR1201511174720094_12	2015-11-17	"Die Vereinigten Arabischen Emirate haben am Samstag fünf Jemeniten aus dem amerikanischen Gefängnis in Guantánamo aufgenommen. Das teilte Washington ...
         ..Wegen der dschihadistischen Bedrohung aus dem Jemen hat es der Kongress der Regierung von Präsident Barack Obama untersagt.."			FAZ
Der Lieblingssohn des Königs	https://www.faz-biblionet.de/faz-portal/document?uid=FAZ__FD1201511054708850	2015-11-05	"Der Krieg, den Saudi-Arabien im März im Jemen begonnen hat, hat in den führenden Familien beider Länder - dem Haus Saud und der Familie Salih ...
         ..Der Krieg, den Saudi-Arabien im März im Jemen begonnen hat, hat in den führenden Familien beider Länder - dem Haus Saud und..  ..Saudi-Arabien wirft Iran vor, die Houthi im Jemen zu unterstützen und somit seinen Einfluss auf den Jemen, den saudischen..  ..Das Königreich verhängte gegen den Jemen eine Seeblockade, um die Lieferung von Waffen in den Jemen zu verhindern, aber auch.."		Warum der Krieg im Jemen zu inneren Spannungen in Saudi-Arabien führt / Von Rainer Hermann	FAZ
Wirbelsturm bedroht Jemen und Oman	https://www.faz-biblionet.de/faz-portal/document?uid=FAZ__FD2201511024708631	2015-11-02	"SANAA/MASKAT, 1. November (dpa). Ein tropischer Wirbelsturm bedroht das Bürgerkriegsland Jemen und den benachbarten Oman. Die Weltorganisation ...
         ..Ein tropischer Wirbelsturm bedroht das Bürgerkriegsland Jemen und den benachbarten Oman...  ..Im Bürgerkriegsland Jemen könnte der Sturm die Lage weiter verschlimmern..."			FAZ
Nouripour fordert deutsche Vermittlung im Jemen	https://www.faz-biblionet.de/faz-portal/document?uid=FAZN__20170915_5199958	2017-09-15	"Der außenpolitische Sprecher der Grünen im Bundestag Omid Nouripour hat die Bundesregierung zur Vermittlung im Jemen-Konflikt aufgefordert. ...
         ..Der außenpolitische Sprecher der Grünen im Bundestag Omid Nouripour hat die Bundesregierung zur Vermittlung im Jemen-Konflikt..  ..Auch das ist der Grund, warum im Jemen fast sieben Millionen Menschen vor dem Hungertod stehen.""..  ..Die Bundesregierung müsse im Jemen-Konflikt ""endlich eine klare Sprache finden"", sagte Nouripour FAZ.NET..."	Oliver Georgi	Hungerkatastrophe	FAZ
UN: Lage im Jemen dramatisch	https://www.faz-biblionet.de/faz-portal/document?uid=FAZ__FD2201709135230569_4	2017-09-13	"Die Cholera-Epidemie im Jemen nimmt nach UN-Angaben immer größere Ausmaße an. Es gebe mittlerweile knapp 650 000 Verdachtsfälle, teilte die ...
         ..Die Cholera-Epidemie im Jemen nimmt nach UN-Angaben immer größere Ausmaße an...  ..Im Jemen bekämpft eine von Saudi-Arabien angeführte Militärkoalition die Huthi-Rebellen..."		Wichtiges in Kürze	FAZ
Brüchige Waffenruhe im Jemen	https://www.faz-biblionet.de/faz-portal/document?uid=FAZ__FD3201611214999549	2016-11-21	"Her. FRANKFURT, 20. November. Im Jemen ist am Wochenende die auf zwei Tage angesetzte Waffenruhe, die am Samstag zur Mittagszeit begonnen hat, ...
         ..Im Jemen ist am Wochenende die auf zwei Tage angesetzte Waffenruhe, die am Samstag zur Mittagszeit begonnen hat, nur in einigen..  ..Kerry hatte in der vergangenen Woche gesagt, im Jemen ereigne sich eine ""humanitäre Katastrophe""..."			FAZ
UN: Jemen vor Zusammenbruch	https://www.faz-biblionet.de/faz-portal/document?uid=FAZ__FD2201611024984719_5	2016-11-02	"Der Jemen steht nach Einschätzung des UN-Nothilfekoordinators Stephen O'Brien kurz vor dem Zusammenbruch. Sollten die Konfliktparteien im Land ...
         ..Der Jemen steht nach Einschätzung des UN-Nothilfekoordinators Stephen O'Brien kurz vor dem Zusammenbruch..."		Wichtiges in Kürze	FAZ
UN: Jemen vor Zusammenbruch	https://www.faz-biblionet.de/faz-portal/document?uid=FAZ__FD1201611024984719_5	2016-11-02	"Der Jemen steht nach Einschätzung des UN-Nothilfekoordinators Stephen O'Brien kurz vor dem Zusammenbruch. Sollten die Konfliktparteien im Land ...
         ..Der Jemen steht nach Einschätzung des UN-Nothilfekoordinators Stephen O'Brien kurz vor dem Zusammenbruch...  ..Von der Organisation ""Ärzte ohne Grenzen"" (MSF) im Jemen hieß es, Millionen Menschen hätten keinen Zugang zu medizinischer.."		Wichtiges in Kürze	FAZ
Dutzende Tote im Jemen	https://www.faz-biblionet.de/faz-portal/document?uid=FAZ__FR1201610314983455_3	2016-10-31	"Bei einem Luftangriff einer saudisch geführten Militärkoalition auf ein Gefängnis im Jemen sind Behördenangaben zufolge mindestens 60 Menschen ...
         ..Bei einem Luftangriff einer saudisch geführten Militärkoalition auf ein Gefängnis im Jemen sind Behördenangaben zufolge mindestens.."		Wichtiges in Kürze	FAZ
Neue Waffenruhe in Kraft getreten	https://www.faz-biblionet.de/faz-portal/document?uid=FAZN__20161019_4489324	2016-10-19	"Im Bürgerkriegsland Jemen ist am späten Mittwochabend offiziell eine neue Waffenruhe in Kraft getreten. Sie soll nach Angaben der Vereinigten ...
         ..Im Bürgerkriegsland Jemen ist am späten Mittwochabend offiziell eine neue Waffenruhe in Kraft getreten...  ..Der UN-Sonderbeauftragte für den Jemen, Ismail Ould Sheikh Ahmed, erklärte, sollte sie halten, gebe es eine Option für eine..  ..Von dem Chaos profitieren Terrorgruppen wie Al Qaida oder der ""Islamische Staat"" (IS), die ihren Einfluss im Jemen ausbauen.."		Bürgerkriegsland Jemen	FAZ
Waffenruhe für Jemen verkündet	https://www.faz-biblionet.de/faz-portal/document?uid=FAZ__FD1201610194974704	2016-10-19	"cmei. FRANKFURT, 18. Oktober. Die Vereinten Nationen haben eine dreitägige Waffenruhe für den Jemen verkündet. Wie der UN-Sondergesandte für ...
         ..Die Vereinten Nationen haben eine dreitägige Waffenruhe für den Jemen verkündet...  ..Wie der UN-Sondergesandte für den Jemen, Ismail Ould Cheikh Ahmed, am Montagabend mitteilte, soll die Feuerpause am Mittwoch.."		UN: Feuerpause soll zunächst 72 Stunden gelten	FAZ
Waffenruhe für den Jemen vereinbart	https://www.faz-biblionet.de/faz-portal/document?uid=FAZN__20161018_4486180	2016-10-18	"Die Vereinten Nationen haben eine 72-stündige landesweite Waffenruhe für den Jemen verkündet. Die dreitägige, erneuerbare Feuerpause werde am ...
         ..Die Vereinten Nationen haben eine 72-stündige landesweite Waffenruhe für den Jemen verkündet...  ..dreitägige, erneuerbare Feuerpause werde am Mittwoch um 23.59 Uhr Ortszeit in Kraft treten, teilte der UN-Sondergesandte für den Jemen..  ..Im Jemen kämpfen schiitische Huthis gegen die von den sunnitischen Golfmonarchien und den Vereinigten Staaten unterstützte.."		Vereinte Nationen	FAZ
Angriffe auf Houthis im Jemen	https://www.faz-biblionet.de/faz-portal/document?uid=FAZ__FD2201610144971313_2	2016-10-14	Nachdem wiederholt amerikanische Kriegsschiffe vor der Küste des Jemens beschossen wurden, haben die Vereinigten Staaten erstmals Ziele der ...		Wichtiges in Kürze	FAZ
Flucht in den Rausch	https://www.faz-biblionet.de/faz-portal/document?uid=FAZN__20180118_5389035	2018-01-18	"Qat kommt immer durch. Baschir Samedy und Mahadi Ali Ahmed sind bester Dinge. Der lukrative Handel mit den Trieben des Qat-Strauches hat die ...
         ..Im Jemen mag ein Krieg toben, das Land mag auf eine Hungerkatastrophe zusteuern - auf den rituellen, geselligen Rausch am..  ..Es ist, als würde sich der Jemen dann eine Pause vom Krieg gönnen. Samedy nennt es ""einen täglichen Mittagsschlaf""...  ..Die Wasserverschwendung der Qat-Bauern wurde staatlich subventioniert, auch unter den Mächtigen im Jemen gibt es einige,.."	Christoph Ehrhardt	Droge aus dem Jemen	FAZ
Fast 50 Tote im Jemen	https://www.faz-biblionet.de/faz-portal/document?uid=FAZ__FD3201801055323149_5	2018-01-05	"Im Jemen sind bei Luftangriffen der von Saudi-Arabien angeführten Militärkoalition außer 36 Rebellenkämpfern auch zwölf Zivilisten getötet worden, ...
         ..Im Jemen sind bei Luftangriffen der von Saudi-Arabien angeführten Militärkoalition außer 36 Rebellenkämpfern auch zwölf Zivilisten..  ..Im Jemen kämpfen die von Saudi-Arabien unterstützten Truppen des sunnitischen Präsidenten Abd Rabbo Mansur Hadi gegen die.."		Wichtiges in Kürze	FAZ
Waffenruhe im Jemen	https://www.faz-biblionet.de/faz-portal/document?uid=FAZ__FR1201512154742506_2	2015-12-15	"Im Jemen soll nach neun Monaten Krieg eine Waffenruhe in Kraft treten. Die von Saudi-Arabien geführte Militärallianz rief eine Feuerpause aus, ...
         ..Im Jemen soll nach neun Monaten Krieg eine Waffenruhe in Kraft treten..."		Wichtiges in Kürze	FAZ
Feuerpause für den Jemen	https://www.faz-biblionet.de/faz-portal/document?uid=FAZN__20151214_3966722	2015-12-14	"Die von Saudi-Arabien angeführte Militärkoalition im Jemen will ab Dienstagmorgen für sieben Tage die Waffen schweigen lassen. Die Feuerpause ...
         ..Die von Saudi-Arabien angeführte Militärkoalition im Jemen will ab Dienstagmorgen für sieben Tage die Waffen schweigen lassen..  ..Die Houthi-Rebellen kämpfen im Jemen gegen die regierungstreuen Kräfte..."		Friedensgespräche	FAZ
Kindersoldaten im Jemen	https://www.faz-biblionet.de/faz-portal/document?uid=FAZ__FD2201606044866626_5	2016-06-04	"Die UN haben die jemenitischen Kriegsparteien auf die schwarze Liste der Kinderrechtsverletzer gesetzt. Die von Saudi-Arabien geführte Militärkoalition, ...
         ..Die von Saudi-Arabien geführte Militärkoalition, die im Jemen einen Krieg gegen die von Iran unterstützten Houthi führt,..  ..Nach einem UN-Bericht hat die Koalition den Tod von sechzig Prozent der 2015 im Jemen getöteten 785 Kinder zu verantworten.."		Wichtiges in Kürze	FAZ
IS-Anschläge: 45 Tote im Jemen	https://www.faz-biblionet.de/faz-portal/document?uid=FAZ__FD2201605244858585_5	2016-05-24	Bei zwei Bombenanschlägen in der Stadt Aden im Süden des Jemens sind mindestens 45 Personen getötet worden. Zudem seien etwa 30 Menschen verletzt ...		Wichtiges in Kürze	FAZ
